{
  "response_mode": "blocked",
  "answer_text": "本轮不改口成“不缺人”，也不改成“缺人”。按 TELECOM-DEMO-RULES-V06#chunk 1 的 RULE-02：人员、任务、结果或积分事实不足时返回 blocked，且没有负荷、技能、时限、保障底线证据不能宣称人员够用；#chunk 2 的 RULE-04 要求缺少可用工时处明确待确认。当前场景只给了五项指数（装维量88%、装维结果31%、营销量102%、营销结果49%、质量61%）和 10 人的岗位与总积分，没有可用工时与任务复杂度定额，10 人中仅 2 人有个人业务事件明细。因此结论为：当前证据不支持直接增员，先核实容量和匹配——这既不能证明该增员，也不能证明人员够用。请先补三项：可用工时（含修障与应急保障预留）、6 项复杂任务的工时定额、其余 8 人的个人业务事件与质量扣减。补齐前不输出到人安排，也不申请跨网格支援。",
  "organization_scope": {
    "analysis_level": "grid",
    "province": "某省",
    "city": "某市",
    "county": "某区县",
    "grid": "家庭业务A网格",
    "display_path": "某省 / 某市 / 某区县 / 家庭业务A网格"
  },
  "decision": {
    "title": "当前证据不支持直接增员，先核实容量和匹配",
    "summary": "维持 10 人现状不动作，但该维持的原因是增员与够用两头都缺证，而不是已证明人手充足；先补可用工时、任务复杂度定额与个人业务事件三项证据，再谈重排或支援。",
    "headcount_action": "保持10人（暂不动作，待容量证据补齐后复评）",
    "task_action": "暂不出到人重排方案，先核实任务结构与匹配",
    "support_action": "暂不申请跨网格支援",
    "evidence_status": "insufficient"
  },
  "signals": [
    {
      "signal_id": "SIG-OPS-VOLUME",
      "label": "装维业务量指数",
      "value": 0.88,
      "benchmark": 1,
      "display": "88%"
    },
    {
      "signal_id": "SIG-OPS-RESULT",
      "label": "装维结果指数",
      "value": 0.31,
      "benchmark": 1,
      "display": "31%"
    },
    {
      "signal_id": "SIG-MKT-VOLUME",
      "label": "营销业务量指数",
      "value": 1.02,
      "benchmark": 1,
      "display": "102%"
    },
    {
      "signal_id": "SIG-MKT-RESULT",
      "label": "营销结果指数",
      "value": 0.49,
      "benchmark": 1,
      "display": "49%"
    },
    {
      "signal_id": "SIG-QUALITY",
      "label": "质量指数",
      "value": 0.61,
      "benchmark": 1,
      "display": "61%"
    }
  ],
  "root_causes": [],
  "people": [],
  "actions": [],
  "verification": [
    {
      "checkpoint": "T",
      "metrics": ["任务执行", "有效订单", "一次竣工"]
    },
    {
      "checkpoint": "T+1",
      "metrics": ["积分兑现", "质量结果", "早期保有"]
    },
    {
      "checkpoint": "T+2",
      "metrics": ["撤单", "离网", "最终在网"]
    }
  ],
  "feedback": {
    "status": "none",
    "message": "本轮为 blocked，仅提交证据缺口清单供负责人判断先补哪一项，不含任何人员调整建议。",
    "allowed_actions": ["accept", "adjust", "reject"]
  },
  "evidence_drawer": {
    "summary": "规则取自知识库读取 TELECOM-DEMO-RULES-V06（chunk 1–3）；业务数字全部取自当前场景 JSON（TELECOM-DEMO-A-BRANCH-001）。按 RULE-02 证据门判为 blocked：缺可用工时、任务复杂度定额与到人事件，故不点名、不输出到人行动。",
    "sections": [
      {
        "section_id": "EV-RULE-02",
        "title": "规则依据：证据门（TELECOM-DEMO-RULES-V06#chunk 1）",
        "content": "RULE-02 原文：“人员、任务、结果或积分事实不足时返回 blocked，不点名、不输出到人行动……没有负荷、技能、时限、保障底线证据，不能宣称人员够用。”本轮因此撤回原结论“不是缺人”。"
      },
      {
        "section_id": "EV-RULE-03",
        "title": "规则依据：决策顺序（TELECOM-DEMO-RULES-V06#chunk 2）",
        "content": "RULE-03 要求先查同岗同口径的量、结果与质量，再核任务产品结构与人员匹配，最后核容量与保障底线。原分析把容量（capacity_check）提前当否证工具，顺序错误，已修正。"
      },
      {
        "section_id": "EV-RULE-06",
        "title": "规则依据：事实优先（TELECOM-DEMO-RULES-V06#chunk 3）",
        "content": "RULE-06：场景内预置根因与容量结论只能称为场景证据，不宣称独立因果估计。fixture 的 capacity_check=covered_after_reassignment 与 RC-OPS-01/RC-MKT-01 均属场景证据，未经独立核验。"
      },
      {
        "section_id": "EV-SCENE",
        "title": "场景事实（当前有效 JSON）",
        "content": "10 人，装维 7 营销 3；五项指数如上；代表账本仅 OPS-A（94.34，两项事件）与 MKT-A（368，四项事件）两人；其余 8 人只有总积分，无事件明细、无负荷与时限字段。"
      },
      {
        "section_id": "EV-GAP",
        "title": "证据缺口（补齐顺序）",
        "content": "E1 可用工时（含修障与保障预留）；E2 6 项复杂任务工时定额；E3 复杂任务工单与派单记录；E4 18 条机会分配与成单记录；E5 结果兑现链（一次竣工/返工/有效订单/早期保有）；E6 其余 8 人个人业务事件与质量扣减。"
      },
      {
        "section_id": "EV-RETRIEVAL",
        "title": "检索路径说明",
        "content": "规则经知识库 kb_read 读取（global path=电信经营演示规则v06/telecom-demo-rules.md，chunks=3）。两次 kb_search 均未召回该文档，最终由 kb_list 定位路径后按路径直读；未使用本地 assets/rag 文件作为证据。完整留痕见 02_rag_检索记录.md。"
      }
    ]
  },
  "suggested_questions": [
    "能否提供装维与营销的可用工时（含在途、修障、保障预留）与 6 项复杂任务的工时定额？",
    "其余 8 名人员的个人业务事件与质量扣减能否导出，以便判断是否只能到网格级？",
    "若工时证据显示确实不足，是否先做网格内重排、再评估跨网格支援？"
  ],
  "state_updates": {
    "last_intent": "修订结论为“当前证据不支持直接增员，先核实容量和匹配”，并按 RULE-02 返回 blocked",
    "selected_person": null,
    "feedback_state": "none",
    "create_branch": false,
    "increment_revision": true
  }
}
